{
  "$comment": "Canonical source: haderach-platform/docs/artifact-manifest.schema.json. Update both repos together when schema changes.",
  "$schema": "http://json-schema.org/draft-07/schema#",
  "$id": "https://haderach.ai/schemas/artifact-manifest/v1",
  "title": "HaderachArtifactManifest",
  "type": "object",
  "required": ["app_id", "version", "commit_sha", "published_at", "artifact", "compatibility"],
  "additionalProperties": false,
  "properties": {
    "app_id": {
      "type": "string",
      "description": "Stable platform identifier for this app."
    },
    "version": {
      "type": "string",
      "description": "Semantic version with build metadata, e.g. 1.2.3+build.45."
    },
    "commit_sha": {
      "type": "string",
      "description": "Full git commit SHA for the build."
    },
    "published_at": {
      "type": "string",
      "format": "date-time",
      "description": "ISO 8601 UTC timestamp of artifact publication."
    },
    "artifact": {
      "type": "object",
      "required": ["runtime_uri", "docs_uri", "checksum_sha256"],
      "additionalProperties": false,
      "properties": {
        "runtime_uri": { "type": "string" },
        "docs_uri": { "type": "string" },
        "checksum_sha256": { "type": "string" }
      }
    },
    "compatibility": {
      "type": "object",
      "required": ["platform_contract_version"],
      "additionalProperties": false,
      "properties": {
        "platform_contract_version": {
          "type": "string",
          "enum": ["v1"],
          "description": "Platform contract version this manifest targets."
        }
      }
    }
  }
}
